{
  "schema_version": "1.0.0",
  "project_id": "proj_demo",
  "run_id": "run_hello_001",
  "span_id": "span_memory_001",
  "kind": "memory",
  "name": "memory.write",
  "status": "ok",
  "started_at": "2026-07-23T09:15:32.210Z",
  "ended_at": "2026-07-23T09:15:32.250Z",
  "memory": {
    "operation": "write",
    "store": "episodic",
    "key": "last_answer",
    "namespace": "demo"
  }
}
