{
  "schema_version": "1.0.0",
  "project_id": "proj_demo",
  "run_id": "run_hello_001",
  "span_id": "span_llm_001",
  "parent_span_id": "span_agent_root",
  "kind": "llm",
  "name": "chat.completions",
  "status": "ok",
  "started_at": "2026-07-23T09:15:30.100Z",
  "ended_at": "2026-07-23T09:15:31.800Z",
  "tags": ["model:gpt-demo"],
  "llm": {
    "provider": "openai",
    "model": "gpt-4.1-mini",
    "tokens_in": 120,
    "tokens_out": 45,
    "tokens_total": 165,
    "temperature": 0.2,
    "finish_reason": "stop",
    "messages": [
      { "role": "user", "content": "What is Sentinel AI?" }
    ],
    "response": {
      "role": "assistant",
      "content": "Sentinel AI observes and evaluates autonomous agents."
    }
  }
}
