{
  "schema_version": "1.0.0",
  "project_id": "proj_demo",
  "run_id": "run_hello_001",
  "span_id": "span_planner_001",
  "kind": "planner",
  "name": "plan_next_step",
  "status": "ok",
  "started_at": "2026-07-23T09:15:30.050Z",
  "ended_at": "2026-07-23T09:15:30.090Z",
  "planner": {
    "planner_name": "react",
    "step_index": 0,
    "plan": ["search", "synthesize", "answer"]
  }
}
